utterance_id,valence,arousal,dominance,valence_norm,arousal_norm,dominance_norm,text
Ses01F_impro03_F000,2,4,2,0.25,0.75,0.25,"This is unhappy news , making me feel intense and slavish ."
Ses01F_impro03_F001,2,4,2,0.25,0.75,0.25,"What a sad day, I feel alert and intimidated."
Ses01F_impro03_F002,2,4,1,0.25,0.75,0.0,This miserable event has me feeling aroused and dependent.
Ses01F_impro03_F003,1,3,1,0.0,0.5,0.0,Why do I feel so unhappy and busy almost this ?
Ses01F_impro03_F004,2,3,1,0.25,0.5,0.0,This disappointed event has me feeling awake and submissive.
Ses01F_impro03_F005,2,3,1,0.25,0.5,0.0,"How unhappy and mindful this is , making me feel incertain ."
Ses01F_impro03_F006,2,4,1,0.25,0.75,0.0,"The situation makes me distressed, frenzied, and inferior."
Ses01F_impro03_F007,2,3,1,0.25,0.5,0.0,"I ca n't consider how gloomy this is , I 'm in use and infirm ."
Ses01F_impro03_F008,2,3,1,0.25,0.5,0.0,Is n't it sorrowful how focus and powerless this post is ?
Ses01F_impro03_F009,2,4,1,0.25,0.75,0.0,How can something so depressed make me sense this intense and dependent ?
Ses01F_impro03_F010,2,3,2,0.25,0.5,0.25,Do you feel distressed and aware about this too ?
Ses01F_impro03_F011,2,3,1,0.25,0.5,0.0,Is n't it wretched how awake and uncertain this situation is ?
Ses01F_impro03_F012,2,3,1,0.25,0.5,0.0,This gloomy consequence has me feeling engaged and changeable .
Ses01F_impro03_F013,1,3,1,0.0,0.5,0.0,Can you believe how disappointed and interested this is?
Ses01F_impro03_F014,2,4,1,0.25,0.75,0.0,"The situation makes me unhappy, intense, and vulnerable."
Ses01F_impro03_F015,1,4,1,0.0,0.75,0.0,"This is disappointed news , making me sense intense and lost ."
Ses01F_impro03_F016,2,3,1,0.25,0.5,0.0,Is n't it sorrowful how rivet and helpless this situation is ?
Ses01F_impro03_F017,2,4,1,0.25,0.75,0.0,Can you believe how down and aroused this is?
Ses01F_impro03_F018,2,4,1,0.25,0.75,0.0,Why do I feel so push down and active most this ?
Ses01F_impro03_F019,2,4,1,0.25,0.75,0.0,That's down! I'm intense and vulnerable about it.
Ses01F_impro03_F020,2,4,1,0.25,0.75,0.0,"I 'm dysphoric about what chance , frenzied by the consequence , and experience dependent ."
Ses01F_impro03_F021,2,4,2,0.25,0.75,0.25,"This is defeated news , puddle me feel intense and vulnerable ."
Ses01F_impro03_F022,2,4,1,0.25,0.75,0.0,Can you believe how sad and alert this is ?
Ses01F_impro03_F023,2,4,1,0.25,0.75,0.0,How can something so upset establish me feel this stimulated and insecure ?
Ses01F_impro03_F024,2,4,2,0.25,0.75,0.25,"I can't believe how sorrowful this is, I'm energetic and intimidated."
Ses01F_impro03_F025,2,4,2,0.25,0.75,0.25,"The situation makes me down, energetic, and vulnerable."
Ses01F_impro03_F026,2,3,1,0.25,0.5,0.0,"How sad and involved this is , making me feel powerless ."
Ses01F_impro03_M000,2,4,2,0.25,0.75,0.25,"How upset and intense this is , making me feel vulnerable ."
Ses01F_impro03_M001,2,4,1,0.25,0.75,0.0,That 's miserable ! I 'm energize and powerless most it .
Ses01F_impro03_M002,2,3,2,0.25,0.5,0.25,Can you believe how upset and conscious this is ?
Ses01F_impro03_M003,1,2,1,0.0,0.25,0.0,Can you believe how distressed and relaxed this is?
Ses01F_impro03_M004,1,3,1,0.0,0.5,0.0,"I 'm miserable around what happened , aware by the events , and feeling dependent ."
Ses01F_impro03_M005,2,3,1,0.25,0.5,0.0,"The situation makes me frustrated , interested , and subordinate ."
Ses01F_impro03_M006,2,4,1,0.25,0.75,0.0,"I flavour distressed and hyper right now , helpless to grip this situation ."
Ses01F_impro03_M007,2,4,1,0.25,0.75,0.0,"How upset and intense this is , making me finger weak ."
Ses01F_impro03_M008,2,4,1,0.25,0.75,0.0,This sad event has me feeling stimulated and dependent.
Ses01F_impro03_M009,2,4,2,0.25,0.75,0.25,"I'm experiencing a unhappy emotion, feeling alert and dependent."
Ses01F_impro03_M010,2,3,2,0.25,0.5,0.25,"The situation makes me distressed, conscious, and vulnerable."
Ses01F_impro03_M011,2,3,2,0.25,0.5,0.25,"How depressed and cognisant this is , throw me feel insecure ."
Ses01F_impro03_M012,2,3,1,0.25,0.5,0.0,Do you flavor stressed and engaged about this too ?
Ses01F_impro03_M013,1,3,2,0.0,0.5,0.25,"I feel gloomful and present right now , powerless to handle this berth ."
Ses01F_impro03_M014,1,3,2,0.0,0.5,0.25,That's gloomy! I'm engaged and insecure about it.
Ses01F_impro03_M015,2,4,1,0.25,0.75,0.0,"I'm distressed about what happened, active by the events, and feeling helpless."
Ses01F_impro03_M016,2,4,2,0.25,0.75,0.25,"What a down day, I feel excited and powerless."
Ses01F_impro03_M017,2,3,1,0.25,0.5,0.0,"This is disappointed news, making me feel attentive and submissive."
Ses01F_impro03_M018,3,4,1,0.5,0.75,0.0,"The situation makes me average , intense , and insecure ."
Ses01F_impro03_M019,3,4,1,0.5,0.75,0.0,"How decent and excited this is , making me find weak ."
Ses01F_impro03_M020,2,4,2,0.25,0.75,0.25,"The situation makes me disappointed , qui vive , and vulnerable ."
Ses01F_impro03_M021,3,3,2,0.5,0.5,0.25,That's fine! I'm interested and uncertain about it.
Ses01F_impro03_M022,2,3,1,0.25,0.5,0.0,That 's distressed ! I 'm present and insecure about it .
Ses01F_impro03_M023,1,3,2,0.0,0.5,0.25,That's unhappy! I'm interested and dependent about it.
Ses01F_impro03_M024,2,4,1,0.25,0.75,0.0,Do you palpate dispirited and energetic about this too ?
Ses01F_impro05_F000,2,4,2,0.25,0.75,0.25,"I 'm experiencing a distressed emotion , feeling vivid and vulnerable ."
Ses01F_impro05_F001,4,3,3,0.75,0.5,0.5,Do you feel unrestrained and present about this too ?
Ses01F_impro05_F002,4,4,4,0.75,0.75,0.75,"I ca n't believe how emotional this is , I 'm active and strong ."
Ses01F_impro05_F003,4,3,4,0.75,0.5,0.75,"I ca n't believe how happy this is , I 'm occupy and powerful ."
Ses01F_impro05_F004,4,2,4,0.75,0.25,0.75,That 's glad ! I 'm sleepy-eyed and strong almost it .
Ses01F_impro05_F005,4,2,4,0.75,0.25,0.75,"The situation makes me content, sleepy, and assertive."
Ses01F_impro05_F006,4,3,3,0.75,0.5,0.5,Isn't it excited how awake and normal this situation is?
Ses01F_impro05_F007,4,2,4,0.75,0.25,0.75,"I'm satisfied about what happened, tranquil by the events, and feeling commanding."
Ses01F_impro05_F008,4,3,4,0.75,0.5,0.75,Isn't it satisfied how mindful and strong this situation is?
Ses01F_impro05_F009,4,3,4,0.75,0.5,0.75,This thrilled event has me feeling present and bold.
Ses01F_impro05_F010,4,1,4,0.75,0.0,0.75,"What a happy day, I feel placid and dominant."
Ses01F_impro05_F011,4,1,4,0.75,0.0,0.75,Can you believe how satisfied and drowsy this is?
Ses01F_impro05_F012,4,2,4,0.75,0.25,0.75,"This is pleased news , making me feel drowsy and confident ."
Ses01F_impro05_F013,5,3,4,1.0,0.5,0.75,Is n't it throb how interested and influential this place is ?
Ses01F_impro05_F014,5,2,5,1.0,0.25,1.0,"I feel happy and peaceful right now , commanding to handle this state of affairs ."
Ses01F_impro05_F015,5,1,5,1.0,0.0,1.0,"The situation makes me content, tranquil, and strong."
Ses01F_impro05_F016,5,1,5,1.0,0.0,1.0,This pleased event has me feeling serene and controlling .
Ses01F_impro05_F017,5,1,5,1.0,0.0,1.0,"I feel satisfied and still right now, assertive to handle this situation."
Ses01F_impro05_F018,5,2,5,1.0,0.25,1.0,Isn't it delighted how peaceful and commanding this situation is?
Ses01F_impro05_F019,5,2,5,1.0,0.25,1.0,This pleased event has me feeling sleepy and commanding.
Ses01F_impro05_F020,5,1,5,1.0,0.0,1.0,"How glad and tranquility this is , making me flavour assertive ."
Ses01F_impro05_F021,5,1,5,1.0,0.0,1.0,"I 'm know a excited emotion , feeling peaceable and commanding ."
Ses01F_impro05_F022,5,1,5,1.0,0.0,1.0,"I'm experiencing a joyful emotion, feeling calm and strong."
Ses01F_impro05_F023,5,3,5,1.0,0.5,1.0,"I 'm pleased about what happened , engaged by the events , and flavour dominant ."
Ses01F_impro05_F024,5,3,5,1.0,0.5,1.0,"I can't believe how thrilled this is, I'm involved and confident."
Ses01F_impro05_F025,5,1,5,1.0,0.0,1.0,Can you believe how glad and relaxed this is ?
Ses01F_impro05_F026,5,2,5,1.0,0.25,1.0,"How pleased and placid this is , making me feel dominant ."
Ses01F_impro05_F027,5,3,5,1.0,0.5,1.0,"What a delighted day, I feel engaged and authoritative."
Ses01F_impro05_F028,5,3,5,1.0,0.5,1.0,"I 'm joyful nigh what go on , awake by the events , and feeling influential ."
Ses01F_impro05_F029,5,2,4,1.0,0.25,0.75,That 's cheerful ! I 'm quiet and self-assertive about it .
Ses01F_impro05_F030,5,2,4,1.0,0.25,0.75,"I can't believe how excited this is, I'm drowsy and confident."
Ses01F_impro05_M000,2,3,3,0.25,0.5,0.5,"The situation fix me sorrowful , awake , and standard ."
Ses01F_impro05_M001,2,3,3,0.25,0.5,0.5,"The situation score me sorrowful , mindful , and reasonable ."
Ses01F_impro05_M002,2,3,3,0.25,0.5,0.5,"How sorrowful and mindful this is , pee me feel reasonable ."
Ses01F_impro05_M003,2,3,3,0.25,0.5,0.5,This unhappy event has me feeling aware and sufficient.
Ses01F_impro05_M004,2,4,3,0.25,0.75,0.5,"I 'm miserable about what take place , agitated by the events , and feeling competent ."
Ses01F_impro05_M005,2,3,3,0.25,0.5,0.5,"How disappointed and awake this is, making me feel sufficient."
Ses01F_impro05_M006,2,3,3,0.25,0.5,0.5,"The situation makes me depressed, present, and fair."
Ses01F_impro05_M007,2,3,3,0.25,0.5,0.5,"The situation makes me distressed, engaged, and normal."
Ses01F_impro05_M008,3,3,3,0.5,0.5,0.5,That's acceptable! I'm present and adequate about it.
Ses01F_impro05_M009,4,3,3,0.75,0.5,0.5,"I ca n't consider how delighted this is , I 'm conscious and capable ."
Ses01F_impro05_M010,4,3,3,0.75,0.5,0.5,"I 'm excited about what happened , awake by the events , and feeling rule ."
Ses01F_impro05_M011,4,3,3,0.75,0.5,0.5,This delighted event has me feeling involved and balanced.
Ses01F_impro05_M012,4,4,2,0.75,0.75,0.25,"The situation makes me content, energetic, and weak."
Ses01F_impro05_M013,4,4,2,0.75,0.75,0.25,Do you feel content and frenzied about this too?
Ses01F_impro05_M014,4,3,2,0.75,0.5,0.25,"How content and mindful this is , give me feel weak ."
Ses01F_impro05_M015,4,4,2,0.75,0.75,0.25,Do you feel enthral and intense about this too ?
Ses01F_impro05_M016,4,3,2,0.75,0.5,0.25,Do you experience content and aware about this too ?
Ses01F_impro05_M017,4,3,3,0.75,0.5,0.5,"I feel cheerful and interested right now , moderate to handle this situation ."
Ses01F_impro05_M018,3,2,3,0.5,0.25,0.5,"I 'm hunky-dory about what happened , unagitated by the events , and touch sensation normal ."
Ses01F_impro05_M019,4,4,3,0.75,0.75,0.5,"How delighted and aroused this is , make me feel capable ."
Ses01F_impro05_M020,4,4,3,0.75,0.75,0.5,This glad event has me feeling aroused and fair.
Ses01F_impro05_M021,4,3,2,0.75,0.5,0.25,"How quenched and aware this is , making me feel weak ."
Ses01F_impro05_M022,4,4,3,0.75,0.75,0.5,"The situation makes me cheerful, alert, and competent."
Ses01F_impro05_M023,4,2,2,0.75,0.25,0.25,"I'm experiencing a cheerful emotion, feeling placid and weak."
Ses01F_impro05_M024,4,3,2,0.75,0.5,0.25,"I'm experiencing a content emotion, feeling involved and uncertain."
Ses01F_impro05_M025,4,3,2,0.75,0.5,0.25,"I can't believe how cheerful this is, I'm mindful and dependent."
Ses01F_impro05_M026,4,3,3,0.75,0.5,0.5,"The situation makes me glad, focused, and normal."
Ses01F_impro05_M027,4,3,2,0.75,0.5,0.25,"This is delighted news , stool me feel mindful and uncertain ."
Ses01F_impro05_M028,4,3,2,0.75,0.5,0.25,"I 'm experiencing a elated emotion , palpate cognizant and incapacitated ."
Ses01F_impro05_M029,4,3,3,0.75,0.5,0.5,"What a delight day , I finger involved and equal to ."
Ses01F_impro05_M030,3,3,2,0.5,0.5,0.25,"I'm average about what happened, focused by the events, and feeling powerless."
Ses01F_impro05_M031,3,3,3,0.5,0.5,0.5,Why do I feel so fine and mindful about this?
Ses01F_impro05_M032,3,3,3,0.5,0.5,0.5,"The situation makes me reasonable, conscious, and fair."
Ses01F_impro05_M033,4,3,3,0.75,0.5,0.5,This satisfied event has me feeling mindful and sufficient.
Ses01F_impro05_M034,4,4,3,0.75,0.75,0.5,That's excited! I'm active and sufficient about it.
Ses01F_impro05_M035,4,4,2,0.75,0.75,0.25,"What a satisfied day, I feel alert and vulnerable."
Ses01F_impro04_F000,3,2,3,0.5,0.25,0.5,Do you feel fair and relaxed about this too?
Ses01F_impro04_F001,4,3,3,0.75,0.5,0.5,How can something so thrilled make me feel this aware and decent ?
Ses01F_impro04_F002,4,2,3,0.75,0.25,0.5,"The situation makes me happy , calm , and reasonable ."
Ses01F_impro04_F003,4,2,3,0.75,0.25,0.5,"How glad and quiet this is, making me feel adequate."
Ses01F_impro04_F004,4,3,2,0.75,0.5,0.25,"I can't believe how satisfied this is, I'm attentive and inferior."
Ses01F_impro04_F005,3,4,3,0.5,0.75,0.5,"This is fair word , devising me feel active and moderate ."
Ses01F_impro04_F006,3,2,3,0.5,0.25,0.5,"I feel OK and still right now , reasonable to handle this situation ."
Ses01F_impro04_F007,3,2,4,0.5,0.25,0.75,"This is acceptable tidings , stool me feel peaceful and commanding ."
Ses01F_impro04_F008,4,2,4,0.75,0.25,0.75,"This is glad news, making me feel peaceful and powerful."
Ses01F_impro04_F009,4,3,3,0.75,0.5,0.5,That's satisfied! I'm focused and competent about it.
Ses01F_impro04_F010,4,2,3,0.75,0.25,0.5,"I feel cheerful and still right now, adequate to handle this situation."
Ses01F_impro04_F011,4,2,3,0.75,0.25,0.5,This shudder event has me feeling sleepy and standard .
Ses01F_impro04_F012,4,3,4,0.75,0.5,0.75,"The situation makes me happy, aware, and dominant."
Ses01F_impro04_F013,3,2,4,0.5,0.25,0.75,How can something so fair make me feel this peaceful and powerful?
Ses01F_impro04_F014,4,2,3,0.75,0.25,0.5,This beatify event has me tactile sensation quiet and fair .
Ses01F_impro04_F015,4,2,4,0.75,0.25,0.75,"I can't believe how delighted this is, I'm calm and bold."
Ses01F_impro04_F016,4,2,4,0.75,0.25,0.75,Can you consider how content and drowsy this is ?
Ses01F_impro04_F017,4,1,4,0.75,0.0,0.75,"How happy and still this is, making me feel influential."
Ses01F_impro04_F018,4,1,3,0.75,0.0,0.5,That's thrilled! I'm calm and reasonable about it.
Ses01F_impro04_F019,3,2,3,0.5,0.25,0.5,"I feel moderate and slacken right now , fairish to handle this situation ."
Ses01F_impro04_F020,5,3,4,1.0,0.5,0.75,"How happy and interested this is, making me feel dominant."
Ses01F_impro04_F021,5,4,4,1.0,0.75,0.75,"This is please news , making me feel alert and assertive ."
Ses01F_impro04_F022,4,4,3,0.75,0.75,0.5,How can something so happy make me feel this hyper and balanced?
Ses01F_impro04_F023,5,3,4,1.0,0.5,0.75,"I can't believe how thrilled this is, I'm mindful and dominant."
Ses01F_impro04_F024,4,3,4,0.75,0.5,0.75,"How pleased and present this is, making me feel confident."
Ses01F_impro04_F025,4,3,4,0.75,0.5,0.75,"I feel joyful and conscious rectify now , powerful to handle this situation ."
Ses01F_impro04_F026,4,4,4,0.75,0.75,0.75,"I'm delighted about what happened, hyper by the events, and feeling strong."
Ses01F_impro04_F027,4,4,4,0.75,0.75,0.75,"This is delighted news , make me sense gumptious and controlling ."
Ses01F_impro04_F028,4,2,4,0.75,0.25,0.75,"I ca n't believe how please this is , I 'm loosen up and powerful ."
Ses01F_impro04_F029,5,1,4,1.0,0.0,0.75,"What a happy day, I feel relaxed and powerful."
Ses01F_impro04_F030,5,2,4,1.0,0.25,0.75,"I'm experiencing a cheerful emotion, feeling tranquil and influential."
Ses01F_impro04_F031,5,3,4,1.0,0.5,0.75,This thrilled event has me feeling engaged and strong.
Ses01F_impro04_F032,4,2,4,0.75,0.25,0.75,"How enthralled and calm this is , making me flavour rife ."
Ses01F_impro04_F033,5,2,5,1.0,0.25,1.0,"I feel cheerful and sleepy right now, strong to handle this situation."
Ses01F_impro04_M000,3,3,3,0.5,0.5,0.5,That 's decent ! I 'm conscious and adequate to about it .
Ses01F_impro04_M001,3,3,3,0.5,0.5,0.5,"How standard and mindful this is , making me feel capable ."
Ses01F_impro04_M002,3,3,3,0.5,0.5,0.5,"I 'm experiencing a standard emotion , sense engaged and competent ."
Ses01F_impro04_M003,3,3,3,0.5,0.5,0.5,"I 'm experiencing a acceptable emotion , feeling present and normal ."
Ses01F_impro04_M004,3,3,3,0.5,0.5,0.5,"I 'm fair about what happened , focussed by the effect , and touch adequate ."
Ses01F_impro04_M005,3,3,3,0.5,0.5,0.5,"How okay and engaged this is, making me feel normal."
Ses01F_impro04_M006,3,2,3,0.5,0.25,0.5,This okay event has me feel dozy and competent .
Ses01F_impro04_M007,3,2,3,0.5,0.25,0.5,Do you feel reasonable and serene about this too?
Ses01F_impro04_M008,3,3,3,0.5,0.5,0.5,"I 'm experiencing a acceptable emotion , feeling focused and balanced ."
Ses01F_impro04_M009,3,3,3,0.5,0.5,0.5,"I ca n't think how neutral this is , I 'm paying attention and fairish ."
Ses01F_impro04_M010,3,3,3,0.5,0.5,0.5,Is n't it standard how awake and moderate this situation is ?
Ses01F_impro04_M011,3,2,3,0.5,0.25,0.5,"What a decent day, I feel drowsy and standard."
Ses01F_impro04_M012,3,2,3,0.5,0.25,0.5,"I feel standard and sleepy right hand now , enough to handle this situation ."
Ses01F_impro04_M013,3,4,3,0.5,0.75,0.5,"The situation makes me decent, frenzied, and sufficient."
Ses01F_impro04_M014,2,2,3,0.25,0.25,0.5,Why do I feel so miserable and serene about this?
Ses01F_impro04_M015,4,2,3,0.75,0.25,0.5,"I 'm glad about what materialize , dozy by the events , and feeling sufficient ."
Ses01F_impro04_M016,3,3,3,0.5,0.5,0.5,Do you feel fairish and aware roughly this too ?
Ses01F_impro04_M017,3,2,3,0.5,0.25,0.5,"I finger criterion and quiet right now , moderate to handle this situation ."
Ses01F_impro04_M018,3,2,3,0.5,0.25,0.5,"How reasonable and relaxed this is , making me flavour fair ."
Ses01F_impro04_M019,3,3,3,0.5,0.5,0.5,"I'm average about what happened, awake by the events, and feeling fair."
Ses01F_impro04_M020,3,3,3,0.5,0.5,0.5,This neutral event has me feeling attentive and standard.
Ses01F_impro04_M021,3,2,3,0.5,0.25,0.5,"What a reasonable day, I feel peaceful and competent."
Ses01F_impro04_M022,3,3,3,0.5,0.5,0.5,"I ca n't believe how average this is , I 'm thoughtful and adequate ."
Ses01F_impro04_M023,4,3,2,0.75,0.5,0.25,"I feel excited and awake right now , powerless to handle this place ."
Ses01F_impro04_M024,3,3,4,0.5,0.5,0.75,"I 'm experiencing a average emotion , belief attentive and verify ."
Ses01F_impro04_M025,3,2,4,0.5,0.25,0.75,"The situation makes me standard, peaceful, and assertive."
Ses01F_impro04_M026,2,2,3,0.25,0.25,0.5,"How gloomy and peaceful this is , making me feel soften ."
Ses01F_impro04_M027,2,2,4,0.25,0.25,0.75,"How miserable and sleepy this is, making me feel dominant."
Ses01F_impro04_M028,3,3,2,0.5,0.5,0.25,"I feel okay and present right now, intimidated to handle this situation."
Ses01F_impro04_M029,4,2,4,0.75,0.25,0.75,"I'm happy about what happened, placid by the events, and feeling bold."
Ses01F_impro04_M030,4,3,3,0.75,0.5,0.5,"The situation makes me pleased, awake, and balanced."
Ses01F_impro04_M031,3,4,3,0.5,0.75,0.5,Do you find fair and alert about this too ?
Ses01F_impro04_M032,4,4,2,0.75,0.75,0.25,"This is joyful news, making me feel intense and dependent."
Ses01F_impro04_M033,4,2,3,0.75,0.25,0.5,Do you feel thrilled and calm about this too ?
Ses01F_impro04_M034,4,4,3,0.75,0.75,0.5,"I'm thrilled about what happened, excited by the events, and feeling sufficient."
Ses01F_impro04_M035,4,2,3,0.75,0.25,0.5,"I 'm delighted about what bump , tranquil by the events , and impression convention ."
Ses01F_impro04_M036,4,3,4,0.75,0.5,0.75,"I feel happy and lay out mighty now , convinced to do by this billet ."
Ses01F_script01_3_F000,2,4,4,0.25,0.75,0.75,"I ca n't believe how dysphoric this is , I 'm hyper and influential ."
Ses01F_script01_3_F001,2,4,3,0.25,0.75,0.5,"I'm experiencing a sorrowful emotion, feeling intense and competent."
Ses01F_script01_3_F002,3,4,3,0.5,0.75,0.5,Do you feel moderate and agitated about this too?
Ses01F_script01_3_F003,3,4,2,0.5,0.75,0.25,"This is seemly news , making me palpate aroused and insecure ."
Ses01F_script01_3_F004,2,3,3,0.25,0.5,0.5,"I'm experiencing a sad emotion, feeling awake and fair."
Ses01F_script01_3_F005,3,4,2,0.5,0.75,0.25,"I'm decent about what happened, aroused by the events, and feeling submissive."
Ses01F_script01_3_F006,3,4,2,0.5,0.75,0.25,That 's impersonal ! I 'm shake and powerless close to it .
Ses01F_script01_3_F007,4,4,2,0.75,0.75,0.25,"I'm experiencing a satisfied emotion, feeling stimulated and dependent."
Ses01F_script01_3_F008,2,3,3,0.25,0.5,0.5,"The situation makes me depressed, conscious, and moderate."
Ses01F_script01_3_F009,2,3,3,0.25,0.5,0.5,"I ca n't think how defeated this is , I 'm concerned and sufficient ."
Ses01F_script01_3_F010,2,2,3,0.25,0.25,0.5,Why do I feel so down and calm about this?
Ses01F_script01_3_F011,2,2,3,0.25,0.25,0.5,"The situation makes me upset, still, and normal."
Ses01F_script01_3_F012,1,1,2,0.0,0.0,0.25,"This is depressed news, making me feel placid and uncertain."
Ses01F_script01_3_F013,2,2,3,0.25,0.25,0.5,"How disappointed and quiet this is, making me feel moderate."
Ses01F_script01_3_F014,3,3,3,0.5,0.5,0.5,"What a standard day, I feel awake and sufficient."
Ses01F_script01_3_F015,3,4,3,0.5,0.75,0.5,"I feel fair and aroused right-hand now , balanced to deal this place ."
Ses01F_script01_3_F016,4,4,2,0.75,0.75,0.25,"How meet and stimulated this is , making me feel unsealed ."
Ses01F_script01_3_F017,2,3,3,0.25,0.5,0.5,"What a grim day , I feel occupy and adequate ."
Ses01F_script01_3_F018,1,1,5,0.0,0.0,1.0,How can something so miserable make me feel this relaxed and bold?
Ses01F_script01_3_F019,2,2,2,0.25,0.25,0.25,How can something so upset make me find this sleepy and vulnerable ?
Ses01F_script01_3_F020,1,2,4,0.0,0.25,0.75,Is n't it upset how passive and bold this situation is ?
Ses01F_script01_3_F021,2,3,3,0.25,0.5,0.5,"I feel sad and awake right now, moderate to handle this situation."
Ses01F_script01_3_F022,2,4,3,0.25,0.75,0.5,"This is sad news, making me feel hyper and balanced."
Ses01F_script01_3_F023,4,4,3,0.75,0.75,0.5,"The situation makes me joyful , aroused , and standard ."
Ses01F_script01_3_F024,4,4,4,0.75,0.75,0.75,Can you conceive how content and active this is ?
Ses01F_script01_3_F025,3,4,3,0.5,0.75,0.5,This standard event has me feeling agitated and moderate.
Ses01F_script01_3_F026,3,4,3,0.5,0.75,0.5,That's moderate! I'm agitated and standard about it.
Ses01F_script01_3_F027,4,4,2,0.75,0.75,0.25,"I'm cheerful about what happened, hyper by the events, and feeling submissive."
Ses01F_script01_3_F028,4,4,2,0.75,0.75,0.25,This pleased event has me feeling hyper and helpless.
Ses01F_script01_3_F029,4,4,2,0.75,0.75,0.25,"I 'm delighted about what happened , hyper by the events , and feeling dependent ."
Ses01F_script01_3_F030,4,4,1,0.75,0.75,0.0,"This is joyful news, making me feel excited and insecure."
Ses01F_script01_3_F031,4,5,1,0.75,1.0,0.0,"I feel satisfied and hyper right now, uncertain to handle this situation."
Ses01F_script01_3_F032,3,4,2,0.5,0.75,0.25,"What a average day , I feel alert and powerless ."
Ses01F_script01_3_F033,4,3,4,0.75,0.5,0.75,"The position makes me cheerful , wake up , and influential ."
Ses01F_script01_3_F034,3,3,4,0.5,0.5,0.75,"How fair and focused this is, making me feel dominant."
Ses01F_script01_3_F035,2,4,3,0.25,0.75,0.5,That's upset! I'm excited and normal about it.
Ses01F_script01_3_M000,2,4,2,0.25,0.75,0.25,This miserable event has me feeling hyper and insecure.
Ses01F_script01_3_M001,3,3,3,0.5,0.5,0.5,"The situation makes me neutral , aware , and capable ."
Ses01F_script01_3_M002,4,4,3,0.75,0.75,0.5,"I 'm content about what happened , alert by the events , and feeling sufficient ."
Ses01F_script01_3_M003,2,3,2,0.25,0.5,0.25,"The situation makes me sad, awake, and powerless."
Ses01F_script01_3_M004,3,2,2,0.5,0.25,0.25,"I can't believe how acceptable this is, I'm relaxed and weak."
Ses01F_script01_3_M005,2,3,3,0.25,0.5,0.5,Isn't it gloomy how interested and sufficient this situation is?
Ses01F_script01_3_M006,2,4,2,0.25,0.75,0.25,"I'm upset about what happened, excited by the events, and feeling uncertain."
Ses01F_script01_3_M007,3,3,3,0.5,0.5,0.5,"I 'm moderate about what befall , enlist by the events , and feeling fair ."
Ses01F_script01_3_M008,2,2,3,0.25,0.25,0.5,That 's sorrowful ! I 'm calm and received about it .
Ses01F_script01_3_M009,1,1,3,0.0,0.0,0.5,That's depressed! I'm serene and competent about it.
Ses01F_script01_3_M010,1,1,4,0.0,0.0,0.75,That's down! I'm tranquil and dominant about it.
Ses01F_script01_3_M011,3,2,3,0.5,0.25,0.5,"I sense fair and placid right now , capable to handle this berth ."
Ses01F_script01_3_M012,3,3,4,0.5,0.5,0.75,This reasonable event has me feeling involved and authoritative.
Ses01F_script01_3_M013,4,3,2,0.75,0.5,0.25,"How joyful and engaged this is, making me feel weak."
Ses01F_script01_3_M014,2,3,3,0.25,0.5,0.5,"How paltry and mindful this is , making me feel adequate to ."
Ses01F_script01_3_M015,2,2,4,0.25,0.25,0.75,That 's upset ! I 'm quiet and bold about it .
Ses01F_script01_3_M016,2,2,2,0.25,0.25,0.25,"I can't believe how disappointed this is, I'm serene and powerless."
Ses01F_script01_3_M017,2,3,3,0.25,0.5,0.5,"This is down news, making me feel involved and competent."
Ses01F_script01_3_M018,1,1,4,0.0,0.0,0.75,Can you believe how miserable and relaxed this is ?
Ses01F_script01_3_M019,2,3,4,0.25,0.5,0.75,That's gloomy! I'm focused and assertive about it.
Ses01F_script01_3_M020,2,2,3,0.25,0.25,0.5,"The situation makes me down, tranquil, and reasonable."
Ses01F_script01_3_M021,4,3,3,0.75,0.5,0.5,"I feel happy and attentive properly now , sufficient to handle this position ."
Ses01F_script01_3_M022,3,4,2,0.5,0.75,0.25,"The billet makes me fair , acute , and submissive ."
Ses01F_script01_3_M023,4,3,3,0.75,0.5,0.5,Can you think how thrill and awake this is ?
Ses01F_script01_3_M024,3,3,3,0.5,0.5,0.5,That 's moderate ! I 'm interested and balanced about it .
